Token Name,Market Price,Market Cap,Narrative Strength,Novelty / Competitiveness,Perseverance,Social Proof,Buy The Dip,Token Distribution,Technical Competency,Risk/Reward,Crash Score,Conviction,Total Score,Median Score,Actual ROI,Additional Notes
Tibbir,$0.01 ,7.8M,9,8,5,7,7,4,7,7.5,2,7,63.5,6.35,,"Supposedly linked to Ribbit Capital, if not by them or disavowed will goto 0 but if confirmed will moon"
Pyano,$0.01 ,8.0M,8,7,5,4.5,4,5,7,6,2,5,53.5,5.35,,Legitimate repo but the concept of the project for devrel is absolutely not going to resonate with degens
AIMXT,$0.00 ,1.7M,8,7,5.5,4,6.5,5,7,8,2,6,59,5.9,,"Seemingly legitimate repo code, but low activity twitter and new repo but aged dev account, could be farm but worth a punt"
Oxy,$0.00 ,690K,8,7,5.5,4,7,5,7,9,2,6,60.5,6.05,,"Seemingly legitimate repo code, seemingly doxxed dev, repo with 16 contributors, decent R/R"
Daydreams,$0.03 ,31.8M,7.5,8,6,5,6,3.5,7,5,2,4,54,5.4,,"Too much sniper owned, too high mcap immediately"